{
  "$schema": "../schema/theme-1.json",
  "schemaVersion": 1,
  "id": "paper",
  "name": {
    "zh-CN": "纸张",
    "zh-TW": "紙張",
    "en-US": "Paper",
    "ja-JP": "ペーパー"
  },
  "author": "OmniZip",
  "appearance": "light",
  "highContrast": false,
  "colors": {
    "bg.canvas": "#F7F3EC",
    "bg.surface": "#FFFDF9",
    "bg.elevated": "#FFFFFF",
    "bg.sidebar": "#F0EAE0",
    "fg.primary": "#2B2620",
    "fg.secondary": "#6B6259",
    "border.default": "#E3DBCE",
    "accent": "#B8641B",
    "success": "#4E8F4A",
    "warning": "#C48A12",
    "danger": "#C04A3F",
    "info": "#3C78A8"
  },
  "effects": {
    "material": "auto"
  },
  "icons": {
    "fileIconTheme": "duotone",
    "typeColors": "muted"
  }
}
